No,Keyword,Search Volume,CPC,Paid Difficulty,SEO Difficulty
978,"when to refinance house loan",210,"$13.92",26,0
979,"which mortgage aggregator for a new broker",70,"$0.00",1,14
980,"white goods loan for centrelink",110,"$3.25",28,8
981,"will applying for a loan hurt my credit",50,"$12.41",23,0
982,"will home loan interest rates go down in 2024",50,"$9.67",14,5
983,"windsor mortgage broker",50,"$20.52",13,14
984,"working capital in finance",90,"$27.86",45,5
985,"200 loan lender",390,"$6.31",74,8
986,"2nd mortgage lender",110,"$26.46",49,9
987,"2nd tier mortgage lenders",110,"$24.69",83,9
