No,Keyword,Search Volume,CPC,Paid Difficulty,SEO Difficulty
1,"a mortgage broker must hold",50,"$0.00",1,6
2,"absolut financial mortgage broker in melbourne",70,"$0.00",1,4
3,"accountant letter for loan",50,"$10.34",23,12
4,"accounting for finance lease",50,"$14.09",5,7
5,"aggregator mortgage broker",260,"$14.83",17,14
6,"albany mortgage brokers",110,"$19.44",60,13
7,"anz bank loan application",260,"$16.84",56,8
8,"anz personal loan application status",70,"$4.39",17,12
9,"app for loan",1600,"$19.09",67,12
10,"application for loan",1600,"$21.63",73,12
11,"apply for a mortgage loan",1300,"$93.52",44,4
12,"apply for a student loan",90,"$5.23",34,12
13,"apply for finance for a car",110,"$49.42",66,11
14,"apply for housing loan online",110,"$98.74",10,9
15,"apply for loan anz",140,"$13.60",56,15
16,"apply for loan cash converters",70,"$10.56",71,5
17,"apply for loan with no credit check",90,"$12.35",79,9
18,"apply for nils loan online nsw",70,"$5.23",47,9
19,"apply for nils loan online qld",70,"$6.46",67,6
20,"apply loan for car",590,"$25.91",30,15
21,"applying for a home loan",1000,"$110.85",22,15
22,"applying for a home mortgage loan",110,"$202.29",13,4
23,"applying for a loan online",720,"$28.76",68,12
24,"applying for centrelink loan",170,"$6.18",56,11
25,"applying for finance",70,"$31.07",79,11
26,"applying for house loan",1300,"$93.52",44,4
27,"approval for home loan",720,"$70.81",40,14
28,"approved for mortgage loan",880,"$48.87",9,8
29,"apr for auto loan",70,"$4.76",14,10
30,"asset finance broker salary",50,"$0.00",1,5
31,"aussie home loan brokers",170,"$10.05",33,0
32,"aussie mortgage brokers",720,"$17.96",45,14
33,"auto loan for international student",140,"$12.30",97,15
34,"auto loan for private sale",140,"$17.98",31,15
35,"average mortgage in australia",1600,"$7.82",7,15
36,"average mortgage in sydney",480,"$6.71",5,0
37,"avoid lenders mortgage insurance",70,"$15.64",12,0
38,"bachelor degree in economics and finance",140,"$6.41",20,6
39,"bachelor in accounting and finance",260,"$12.17",35,4
40,"bachelor in finance",1300,"$8.54",34,12
41,"bachelor in finance and banking",170,"$2.91",13,1
42,"bank best mortgage rates",110,"$10.25",31,15
43,"bank for business loan",880,"$15.59",20,9
44,"bank for car loan",880,"$16.42",48,2
45,"bank loan for small business",260,"$32.23",6,5
46,"bank loan for students",110,"$3.45",21,0
47,"bank mortgage vs broker",260,"$13.51",20,12
48,"bank or broker for mortgage",320,"$17.02",15,0
49,"banking in finance course",170,"$7.23",40,2
50,"banks vs mortgage brokers",320,"$12.86",33,8
51,"bathurst mortgage broker",170,"$11.26",40,14
52,"benefits of mortgage broker",70,"$0.20",20,4
53,"best 5 year mortgage rates",140,"$3.90",8,9
54,"best bank personal loan",320,"$26.00",69,14
55,"best bank to get home loan",90,"$47.28",74,14
56,"best banks for home loan",1300,"$41.63",67,8
57,"best canberra mortgage brokers",210,"$23.30",32,0
58,"best car deal finance",320,"$15.19",87,13
59,"best car finance brisbane",50,"$16.81",13,9
60,"best car loan company",170,"$30.58",56,12
61,"best car loan rates for new cars",70,"$13.57",78,14
62,"best finance newsletters",70,"$4.56",4,2
63,"best finance university in australia",70,"$6.34",21,0
64,"best for personal loan",1900,"$33.61",74,14
65,"best home loan banks australia",70,"$31.09",87,9
66,"best home loan first time buyer",320,"$13.77",7,2
67,"best home loan for first time buyers",390,"$29.47",5,0
68,"best home loan offset account",110,"$28.03",82,2
69,"best home loan rate with offset",140,"$36.93",86,2
70,"best investment home loan rate australia",260,"$11.29",82,6
71,"best investment loan rates in australia",170,"$9.58",85,12
72,"best investment mortgage lenders",210,"$18.29",76,9
73,"best loan debt consolidation",1000,"$31.33",28,14
74,"best loan for a first time home buyer",320,"$18.32",15,2
75,"best loan for students",50,"$8.13",19,11
76,"best mortgage banks",590,"$24.87",32,15
77,"best mortgage broker aggregator",70,"$21.25",1,14
78,"best mortgage broker canberra",170,"$21.19",28,15
79,"best mortgage broker perth wa",390,"$20.85",47,9
80,"best mortgage broker townsville",70,"$16.98",25,15
81,"best mortgage broker wollongong",70,"$21.62",4,14
82,"best mortgage companies near me",320,"$26.66",21,10
83,"best mortgage for first home buyers",390,"$16.54",12,9
84,"best mortgage providers",90,"$37.73",22,15
85,"best mortgage rate for 5 year fixed",140,"$3.90",8,9
86,"best mortgage rates for investment properties",140,"$12.29",64,6
87,"best mortgage rates for investment property",70,"$11.75",76,6
88,"best mortgage refinance deals",70,"$19.35",72,13
89,"best motorcycle finance australia",70,"$26.92",88,8
90,"best payday loan lenders",140,"$14.57",75,12
91,"best personal finance software australia",140,"$11.73",97,12
92,"best personal loan consolidation",70,"$52.22",16,10
93,"best personal loan lenders",1900,"$33.98",71,14
94,"best podcast finance",260,"$5.78",9,6
95,"best rate business loan",140,"$14.96",17,8
96,"best rate mortgage refinance",720,"$29.71",65,12
97,"best rate new car loan",70,"$14.86",30,15
98,"best rates interest only mortgage",210,"$7.15",47,4
99,"best refinance mortgage loans",590,"$36.57",44,13
100,"best reverse mortgage lenders australia",70,"$11.41",73,5
101,"best short term loan australia",210,"$17.72",63,2
102,"best universities for finance in australia",70,"$6.14",22,0
103,"best university in australia for finance",70,"$4.59",20,0
104,"best used car loan australia",70,"$15.76",88,7
105,"best variable rate mortgage",390,"$9.08",66,15
106,"biggest finance companies in australia",70,"$45.09",15,0
107,"bike for finance",320,"$22.27",70,10
108,"bloom finance brokers",110,"$9.07",3,5
109,"bond loan application form",70,"$5.97",8,0
110,"bond loan application forms qld",70,"$5.89",7,9
111,"bondi mortgage broker",140,"$7.60",17,12
112,"brisbane finance brokers",390,"$25.24",31,15
113,"broker mortgage license",390,"$7.29",40,9
114,"broker or bank for home loan",320,"$12.86",33,0
115,"building a house loan",90,"$9.65",42,1
116,"bunbury mortgage brokers",320,"$18.73",53,14
117,"business finance for car",1300,"$34.38",25,13
118,"business finance for cars",720,"$45.36",21,2
119,"business for sale vendor finance",210,"$4.32",30,0
120,"business loan brokers brisbane",90,"$22.47",17,8
121,"business loan for 50k",90,"$15.40",13,7
122,"business loan for small business government",170,"$15.74",33,15
123,"buy car in finance",320,"$12.43",71,13
124,"buy to let mortgage lenders",210,"$9.19",18,11
125,"calculate loan payment for car",1300,"$4.30",37,13
126,"calculator for car finance",22200,"$5.26",51,12
127,"calculator for car loan",60500,"$4.66",49,12
128,"calculator for home equity loan",1600,"$4.73",52,10
129,"calculator for land loan",390,"$2.85",47,11
130,"calculator for personal loan payment",170,"$2.58",24,13
131,"calculator for reverse mortgage",1600,"$8.36",47,14
132,"calculators for finance",9900,"$3.85",62,2
133,"camper for finance",390,"$24.35",13,3
134,"can i get a house loan",320,"$26.71",62,4
135,"can you get a house loan without a deposit",140,"$9.51",60,4
136,"can you include renovation costs in a mortgage australia",70,"$7.66",5,0
137,"car finance for bad credit brisbane",50,"$13.74",87,11
138,"car finance for centrelink",3600,"$9.61",85,11
139,"car finance for pensioners",260,"$11.41",86,12
140,"car finance rates in australia",2400,"$11.29",67,14
141,"car loan apply online",110,"$53.00",50,14
142,"car loan best bank",210,"$13.79",28,14
143,"car loan broker brisbane",90,"$43.84",81,12
144,"car loan broker melbourne",210,"$16.85",47,12
145,"car loan brokers melbourne",210,"$22.05",17,12
146,"car loan calculator for early payoff",70,"$15.40",7,13
147,"car loan for centrelink",90,"$9.99",85,12
148,"car loan for nurses",50,"$16.38",94,11
149,"car loan for single parent pensioners",140,"$14.79",67,15
150,"car loan for uber",70,"$13.46",86,14
151,"car loan for used car calculator",320,"$6.20",48,13
152,"car loan in australia for international students",70,"$9.50",95,15
153,"cars for finance melbourne",1000,"$21.86",92,14
154,"cars on finance near me",590,"$13.32",64,2
155,"cash loan for centrelink",1900,"$3.64",73,6
156,"central coast mortgage brokers",720,"$18.64",20,11
157,"certificates in finance",320,"$10.99",41,3
158,"change mortgage lender",90,"$19.88",45,7
159,"changing home loan lenders",90,"$19.88",45,6
160,"chart for mortgage interest rates",50,"$12.61",18,11
161,"chattel mortgage for car",70,"$16.30",46,4
162,"chattel mortgage lenders",170,"$28.90",33,13
163,"cheapest business loan",140,"$22.94",21,8
164,"cheapest car loan adelaide",70,"$20.21",95,9
165,"cheapest car loan interest rates australia",70,"$14.19",68,14
166,"cheapest rate car loan",480,"$19.54",43,11
167,"cheltenham mortgage brokers",90,"$3.24",18,13
168,"commbank house loan",140,"$2.93",77,4
169,"commission for mortgage broker",390,"$8.08",7,0
170,"commonwealth loan application",170,"$6.35",51,15
171,"conditional approval for home loan",320,"$24.10",41,5
172,"conditional approval for mortgage",390,"$29.13",30,15
173,"consulting in finance",1600,"$10.35",9,15
174,"cost for refinancing mortgage",720,"$12.78",22,0
175,"cost of mortgage broker",480,"$7.60",24,0
176,"courses for finance",3600,"$9.44",36,4
177,"credit hub australia mortgage broker point cook",90,"$0.05",7,11
178,"credit score for a loan",110,"$11.33",20,8
179,"crisis loan for rent arrears victoria",110,"$4.43",65,15
180,"criteria for a home loan",260,"$10.18",20,9
181,"cronulla mortgage broker",140,"$17.81",40,15
182,"current interest rate for business loan",170,"$8.13",15,6
183,"current interest rate for car loan",590,"$9.37",51,14
184,"current interest rate for home loan",2900,"$6.92",48,15
185,"current interest rate for personal loan",260,"$6.75",57,12
186,"current mortgage interest rates in australia",590,"$8.36",54,12
187,"data science for finance",70,"$9.74",22,12
188,"data science in finance",70,"$8.63",12,9
189,"debtor finance broker",70,"$0.00",1,11
190,"dee why mortgage brokers",50,"$17.37",33,15
191,"degree for accounting and finance",110,"$9.13",36,6
192,"degree in applied finance",70,"$28.16",40,12
193,"degree in finance",1300,"$13.46",42,12
194,"deposit for mortgage calculator",1000,"$5.43",56,8
195,"deposit needed for home loan calculator",70,"$5.38",53,5
196,"development in finance",260,"$13.12",33,7
197,"diploma in finance and mortgage broking",880,"$11.60",86,14
198,"direct lender for loan",70,"$8.54",61,12
199,"direct lender payday loan",110,"$4.92",56,15
200,"direct loan lenders",70,"$8.54",61,12
201,"diversification in finance",50,"$3.90",6,15
202,"do mortgage brokers charge",110,"$6.54",10,0
203,"dubbo mortgage brokers",320,"$28.66",42,15
204,"easy loan for business",140,"$92.69",38,8
205,"education loan in australia",1900,"$4.52",40,11
206,"eligibility for a home loan",320,"$25.43",63,6
207,"eltham mortgage broker",70,"$31.56",23,10
208,"emi calculator for vehicle loan",390,"$3.89",42,12
209,"emi for personal loan calculator",110,"$3.65",36,12
210,"engineers in finance",590,"$6.46",1,14
211,"equipment loan for business",880,"$43.93",18,0
212,"equity in finance",390,"$8.20",6,14
213,"equity in home loan",1900,"$11.39",56,10
214,"equity loan on house",1900,"$11.39",56,8
215,"erp in finance",260,"$36.34",16,6
216,"ev in finance",170,"$16.90",54,4
217,"fee for mortgage broker",480,"$7.60",24,0
218,"fha requirements for home loan",70,"$8.90",23,12
219,"finance broker ballarat",480,"$19.95",35,14
220,"finance broker castle hill",260,"$22.74",27,14
221,"finance broker commission",390,"$4.39",5,15
222,"finance broker courses",260,"$6.98",69,1
223,"finance broker frankston",170,"$22.76",21,1
224,"finance broker gympie",70,"$11.70",98,6
225,"finance broker jobs melbourne",140,"$4.98",28,0
226,"finance broker joondalup",170,"$26.06",51,13
227,"finance broker penrith",480,"$19.35",12,7
228,"finance broker shepparton",210,"$15.17",43,12
229,"finance broker st kilda",170,"$6.95",13,12
230,"finance broker sunshine coast",880,"$21.26",28,8
231,"finance broker tamworth",140,"$14.03",76,8
232,"finance broker townsville",590,"$21.99",66,15
233,"finance brokers ballarat",480,"$19.95",35,14
234,"finance brokers rockhampton",50,"$25.33",60,13
235,"finance brokers shepparton",210,"$16.71",34,9
236,"finance business for sale",50,"$3.73",24,13
237,"finance car gold coast",210,"$18.92",90,9
238,"finance cars for cheap",880,"$18.07",93,6
239,"finance courses for banking",140,"$5.72",31,15
240,"finance deals for cars",590,"$12.98",89,15
241,"finance degree in australia",70,"$11.97",75,7
242,"finance for a small business",480,"$30.41",8,8
243,"finance for bad credit motorcycle",50,"$11.15",88,14
244,"finance for buying a car",320,"$12.43",71,14
245,"finance for farm machinery",880,"$29.53",8,13
246,"finance for horse floats",110,"$14.83",31,0
247,"finance for management",1300,"$5.38",6,4
248,"finance for medical equipment",50,"$19.42",33,15
249,"finance for small business",390,"$36.76",20,12
250,"finance for swimming pools",140,"$12.27",79,12
251,"finance for tesla",210,"$9.54",65,1
252,"finance house pjsc",90,"$10.64",10,8
253,"finance in agriculture",720,"$17.52",15,15
254,"finance in education",320,"$3.24",21,3
255,"finance in small business",390,"$36.76",20,12
256,"finance loan for business",480,"$36.33",7,8
257,"finance management for business",50,"$14.93",32,15
258,"finance rate for used car",390,"$14.09",28,9
259,"finance rates for motorcycles",110,"$8.65",25,13
260,"finance report format in excel",90,"$5.71",87,9
261,"finance service near me",170,"$10.26",10,9
262,"finance tips for women",70,"$5.30",31,15
263,"financial loan calculator for cars",720,"$5.43",62,15
264,"financing for a car loan",1600,"$30.61",61,14
265,"first choice mortgage broker",70,"$10.77",32,15
266,"first home buyers lenders mortgage insurance",140,"$7.40",45,6
267,"first house loan",880,"$21.88",44,2
268,"first time buyer house loan",2400,"$9.85",31,15
269,"first time home buyer mortgage lender",1600,"$21.25",30,0
270,"fixed rate of interest for home loan",720,"$4.14",7,8
271,"for house loan what documents required",90,"$12.49",57,4
272,"forecast for mortgage interest rates",260,"$6.31",12,9
273,"free template for loan agreement",110,"$4.35",16,10
274,"fundo loan application",90,"$5.17",79,11
275,"geraldton mortgage broker",170,"$21.91",18,15
276,"get a loan for a car",720,"$32.24",55,14
277,"get approved for home loan",70,"$31.62",15,10
278,"getting pre approval for a home loan",880,"$58.62",24,13
279,"getting prequalified for home loan",880,"$143.37",27,8
280,"gold coast finance brokers",320,"$22.08",11,15
281,"gold loan in melbourne",140,"$4.70",33,15
282,"good mortgage lenders first time buyers",390,"$13.74",3,6
283,"graduate programs for finance",260,"$2.10",15,0
284,"graduate programs in finance",260,"$3.10",14,0
285,"graduate roles in finance",90,"$4.47",18,0
286,"guarantee for loan",480,"$13.32",70,8
287,"guarantor for a mortgage",720,"$3.58",43,6
288,"guarantor for mortgage loan",880,"$14.51",40,4
289,"home improvement loan lenders",480,"$16.20",33,15
290,"home loan application online",70,"$111.47",78,11
291,"home loan broker central coast",590,"$21.91",26,0
292,"home loan broker in australia",720,"$19.98",28,14
293,"home loan broker in brisbane",2900,"$21.90",33,15
294,"home loan broker parramatta",480,"$17.31",11,9
295,"home loan brokers bendigo",480,"$12.60",32,0
296,"home loan brokers bundaberg",210,"$24.08",71,13
297,"home loan brokers rockhampton",260,"$22.59",57,9
298,"home loan brokers shepparton",210,"$15.17",43,12
299,"home loan brokers sunshine coast",880,"$22.34",28,10
300,"home loan brokers townsville",590,"$25.01",23,0
301,"home loan for dentist",90,"$30.28",16,14
302,"home loan for dentists",70,"$28.25",90,15
303,"home loan for indigenous australian",1600,"$8.71",33,0
304,"home loan for veterinarians",50,"$22.16",35,13
305,"home loan grants for first time buyers",480,"$5.36",26,13
306,"home loan in brisbane",480,"$12.39",4,7
307,"home loan in perth",390,"$17.77",11,9
308,"home loan lenders in australia",170,"$32.67",55,2
309,"house loan bank rate",210,"$20.95",59,10
310,"house loan deposit calculator",1000,"$4.69",48,1
311,"house loan eligibility",260,"$27.31",65,10
312,"house loan pagibig",170,"$12.64",1,0
313,"house loan percentage rate",27100,"$12.27",62,15
314,"house loan procedure",210,"$10.50",35,3
315,"house loan refinance calculator",2400,"$8.71",50,4
316,"house mortgage requirements",210,"$15.68",55,7
317,"how can i get a loan for a house",720,"$22.42",51,4
318,"how can i get approved for a home loan",720,"$22.77",4,7
319,"how do i apply for a small business loan",260,"$17.66",3,15
320,"how do i find a mortgage broker",90,"$18.92",65,12
321,"how do i get a loan for an investment property",70,"$13.26",53,12
322,"how do you apply for a business loan",390,"$20.75",31,15
323,"how do you apply for a home loan",590,"$35.22",40,2
324,"how do you get approved for a house loan",390,"$21.25",35,7
325,"how does equity work in home loan",390,"$2.65",39,10
326,"how does house mortgage work",110,"$7.54",23,12
327,"how does mortgage broker work",70,"$8.14",34,14
328,"how long does it take for home loan approval",320,"$7.91",22,0
329,"how long does mortgage application take",50,"$13.55",23,12
330,"how long does pre approval for a home loan take",210,"$11.43",28,1
331,"how long to get pre approval for home loan",90,"$31.47",40,4
332,"how much can i borrow for personal loan calculator",170,"$2.65",23,1
333,"how much can i get a home loan for",590,"$4.90",22,12
334,"how much can i get in a home loan",590,"$4.90",22,12
335,"how much can you borrow for home loan",170,"$4.39",75,9
336,"how much do mortgage brokers cost",210,"$8.28",32,0
337,"how much do mortgage brokers get paid in australia",70,"$24.04",4,15
338,"how much does a mortgage broker charge",210,"$7.23",27,14
339,"how much does a mortgage broker cost australia",50,"$3.16",32,0
340,"how much house loan can i get",390,"$8.42",56,1
341,"how much loan i can get for business",210,"$9.91",20,7
342,"how to apply for student start up loan",50,"$4.49",8,0
343,"how to apply loan for car",110,"$19.09",51,14
344,"how to avoid lenders mortgage insurance",320,"$8.43",16,0
345,"how to be mortgage broker",170,"$6.43",51,1
346,"how to find mortgage brokers",90,"$18.92",65,12
347,"how to get a approved for a home loan",390,"$21.25",35,8
348,"how to get a house loan",320,"$30.44",40,7
349,"how to get a loan for car",880,"$18.03",60,2
350,"how to get a loan with bad credit in australia",50,"$13.89",87,13
351,"how to get loan for home",720,"$17.96",28,14
352,"how to get loan for investment property",50,"$6.97",47,14
353,"how to get pre approved for a house loan",1300,"$30.47",43,8
354,"how to pay house loan faster",140,"$2.50",27,0
355,"how to pay off a mortgage in 10 years",720,"$2.61",22,12
356,"how to pay off your home loan in 5 years",260,"$2.51",23,12
357,"i haven't paid my mortgage in 7 years",50,"$3.95",18,0
358,"independent broker mortgage",260,"$24.92",7,13
359,"independent mortgage brokers",260,"$21.09",12,14
360,"infinity mortgage brokers",210,"$18.24",19,12
361,"instant cash loan for pensioners",70,"$7.73",23,12
362,"insurance for car loan",110,"$19.63",33,0
363,"insurance for housing loan",390,"$29.51",50,5
364,"insurance for loan protection",260,"$11.50",31,0
365,"insurance for mortgage",2400,"$10.10",21,5
366,"insurance for mortgage payment protection",1000,"$9.76",23,12
367,"interactive broker margin loan",70,"$2.79",25,15
368,"interest calculator for car loan",1600,"$2.71",30,12
369,"interest calculator for personal loan",390,"$2.50",27,9
370,"interest for business loan",480,"$5.26",12,0
371,"interest for housing loan",1000,"$13.06",56,15
372,"interest free house loan",110,"$6.42",28,14
373,"interest rate for business loan",2400,"$5.36",26,13
374,"interest rate for car loan calculator",590,"$3.89",37,12
375,"international loan for students",880,"$5.77",62,7
376,"internet mortgage lenders",210,"$37.95",32,7
377,"interview questions for finance",50,"$4.56",3,6
378,"invoice finance for small businesses",90,"$42.39",18,0
379,"is mortgage broker a good career",50,"$10.07",25,15
380,"islamic banking house loan",90,"$5.74",25,13
381,"job description of a mortgage broker",90,"$4.36",31,15
382,"job for finance graduate",260,"$2.39",8,0
383,"jobs for mortgage broker",720,"$7.08",25,0
384,"jobs for mortgage brokers",720,"$5.81",26,0
385,"jobs in finance for graduates",260,"$2.17",12,0
386,"law in finance",170,"$2.39",5,0
387,"lead generation for mortgage",110,"$8.11",16,10
388,"lender mortgage insurance australia",110,"$7.74",11,9
389,"lender requirements for mortgage",210,"$15.68",55,4
390,"lenders mortgage insurance aus",110,"$18.33",17,11
391,"lenders mortgage insurance costs",320,"$3.44",7,8
392,"lenders mortgage insurance exemption",170,"$7.66",9,8
393,"lenders mortgage insurance lmi",720,"$8.75",14,10
394,"lenders mortgage insurance lmi calculator",1300,"$3.95",32,15
395,"lenders mortgage insurance waived",1000,"$7.26",21,0
396,"leveraging in finance",590,"$6.12",1,14
397,"life insurance for home loan",590,"$28.08",2,0
398,"loan",49500,"$18.66",88,82
399,"loan agreement for personal loan",170,"$3.32",20,12
400,"loan apply online business",140,"$66.28",4,7
401,"loan calculator for a boat",1000,"$5.91",31,15
402,"loan calculator for debt consolidation",390,"$17.76",63,7
403,"loan calculator for recreational vehicle",70,"$5.50",56,14
404,"loan for 100",390,"$5.24",67,11
405,"loan for 100 dollars",170,"$7.32",85,13
406,"loan for a jet ski",320,"$30.42",49,14
407,"loan for a tiny home",210,"$7.69",78,15
408,"loan for a wedding",1300,"$16.30",32,15
409,"loan for agriculture business",90,"$17.78",18,3
410,"loan for boat motor",70,"$13.72",8,8
411,"loan for breast implants",50,"$15.60",16,12
412,"loan for business in uk",50,"$6.44",26,13
413,"loan for business interest rate",2900,"$8.80",35,5
414,"loan for camper trailer",140,"$38.87",59,15
415,"loan for car interest rate",14800,"$11.15",51,12
416,"loan for car private sale",140,"$15.72",27,14
417,"loan for car repair with bad credit",50,"$10.90",76,13
418,"loan for centrelink customers",170,"$5.69",79,14
419,"loan for commercial car",320,"$37.67",24,0
420,"loan for credit card debt consolidation",590,"$27.82",2,13
421,"loan for dentist",70,"$20.46",54,14
422,"loan for dentist work",140,"$13.99",33,15
423,"loan for deposit",170,"$14.77",56,1
424,"loan for disability pension",170,"$8.67",56,7
425,"loan for farm equipment",320,"$23.22",20,0
426,"loan for farmland purchase",50,"$5.23",9,8
427,"loan for first car",90,"$19.32",35,9
428,"loan for house building",90,"$9.65",42,1
429,"loan for house improvement",480,"$31.27",28,0
430,"loan for investment",2400,"$16.84",65,2
431,"loan for low income",720,"$13.89",80,7
432,"loan for modular home",70,"$13.29",84,12
433,"loan for paying off debt",170,"$21.43",44,14
434,"loan for pensioners",2900,"$10.72",72,3
435,"loan for personal business",320,"$26.54",31,12
436,"loan for plastic surgery",320,"$16.02",64,13
437,"loan for purchasing a business",1600,"$9.97",33,15
438,"loan for recreational vehicle",390,"$30.07",24,14
439,"loan for rural property",140,"$12.03",27,0
440,"loan for shed",50,"$13.21",83,14
441,"loan for start up business",1900,"$17.93",33,2
442,"loan for students",3600,"$5.26",38,11
443,"loan for study",320,"$4.95",38,11
444,"loan for the car",590,"$19.03",71,14
445,"loan for tiny home",210,"$8.40",49,12
446,"loan for tiny house",90,"$4.36",74,15
447,"loan for travel trailer",260,"$32.95",39,1
448,"loan for vehicle calculator",390,"$5.91",56,12
449,"loan for yacht",90,"$25.20",75,11
450,"loan in an hour",50,"$12.21",67,3
451,"loan interest rates for commercial property",880,"$6.21",21,0
452,"loan interest rates for used cars",210,"$8.19",11,9
453,"loan market brokers",70,"$10.37",24,9
454,"loan private lender",210,"$16.90",78,7
455,"loan rate for business",1600,"$7.57",31,6
456,"loan rates for new cars",480,"$10.28",55,14
457,"loan rates for rv",50,"$16.65",18,15
458,"loan rates for small business",480,"$14.73",15,8
459,"loan repayment calculator for car",22200,"$3.59",48,12
460,"loan repayment calculator house",260,"$3.63",18,11
461,"loan sharks in brisbane",50,"$4.92",78,13
462,"loan to invest in shares",260,"$11.38",52,14
463,"loan types for business",170,"$10.72",22,0
464,"lowest home loan rate in australia",880,"$19.43",64,13
465,"lowest interest rate for a personal loan",480,"$30.68",38,11
466,"lowest interest rate in personal loan",320,"$35.29",66,12
467,"lowest loan rate for car",1300,"$13.01",33,15
468,"machine learning for finance",140,"$5.85",15,10
469,"major in finance",320,"$5.63",6,3
470,"marketing for mortgage broker",170,"$35.76",2,13
471,"master in accounting and finance",170,"$6.26",32,11
472,"master in applied finance",50,"$4.27",50,12
473,"master in finance australia",90,"$21.23",25,15
474,"master of science in quantitative finance",260,"$13.28",21,9
475,"masters in finance and management",260,"$13.82",15,13
476,"masters in finance university of melbourne",390,"$14.51",9,14
477,"masters in finance unsw",720,"$14.91",20,2
478,"masters in mathematical finance",260,"$12.66",13,13
479,"mathematics for finance",1000,"$6.03",2,10
480,"metro finance broker login",50,"$0.00",1,14
481,"michael xia mortgage broker",50,"$0.00",3,0
482,"minimum credit score for home loan australia",140,"$12.29",36,15
483,"mortgage advisor in doncaster",110,"$29.14",23,12
484,"mortgage aggregators in australia",90,"$11.23",68,14
485,"mortgage banks near me",480,"$36.00",28,14
