No,Keyword,Search Volume,CPC,Paid Difficulty,SEO Difficulty
1,"best home loan broker brisbane",20,"$26.71",28,14
2,"best mortgage broker brisbane",480,"$30.98",68,27
3,"best mortgage broker qld",20,"$19.25",47,20
4,"borro mortgage broker brisbane",10,"$0.00",3,6
5,"brisbane car finance broker",10,"$0.00",100,36
6,"brisbane home loan broker",2400,"$24.42",38,35
7,"business finance broker brisbane",20,"$22.40",5,7
8,"car finance broker brisbane",90,"$24.32",60,30
9,"commercial mortgage broker brisbane",10,"$0.00",13,9
10,"crew financial mortgage broker investment home loans brisbane",10,"$0.00",1,5
11,"equipment finance broker brisbane",10,"$0.00",13,9
12,"finance broker brisbane",390,"$25.24",31,28
13,"finance broker qld",20,"$0.00",5,15
14,"home loan broker brisbane",2900,"$26.84",37,31
15,"how to become a mortgage broker qld",50,"$10.19",14,17
16,"independent mortgage broker brisbane",70,"$26.81",82,27
17,"mortgage broker ashgrove",20,"$11.60",45,27
18,"mortgage broker aspley",90,"$0.00",1,14
19,"mortgage broker auchenflower",20,"$0.00",10,17
20,"mortgage broker bayswater north",10,"$0.00",1,5
21,"mortgage broker brisbane",3600,"$27.08",30,33
22,"mortgage broker brisbane city",70,"$22.37",31,37
23,"mortgage broker brisbane hunter galloway",90,"$0.00",2,6
24,"mortgage broker brisbane north",720,"$26.18",6,22
25,"mortgage broker brisbane review",20,"$13.55",50,21
26,"mortgage broker brisbane reviews",20,"$11.75",15,10
27,"mortgage broker brisbane south",10,"$7.29",24,13
28,"mortgage broker bulimba",20,"$15.82",28,22
29,"mortgage broker bundaberg qld",210,"$24.08",71,14
30,"mortgage broker chermside",40,"$35.36",17,19
31,"mortgage broker clyde north",70,"$51.42",26,10
32,"mortgage broker course brisbane",30,"$5.69",79,29
33,"mortgage broker course qld",10,"$4.12",96,34
34,"mortgage broker croydon north",10,"$0.00",1,5
35,"mortgage broker east brisbane",20,"$0.00",11,9
36,"mortgage broker emerald qld",10,"$14.02",46,19
37,"mortgage broker gladstone qld",50,"$32.72",38,13
38,"mortgage broker gold coast qld",1000,"$27.55",36,0
39,"mortgage broker in brisbane",3600,"$24.56",35,17
40,"mortgage broker in north sydney",10,"$0.00",31,15
41,"mortgage broker in qld",90,"$26.83",11,36
42,"mortgage broker ipswich qld",20,"$15.95",56,22
43,"mortgage broker job brisbane",70,"$7.26",25,0
44,"mortgage broker jobs brisbane",50,"$6.49",46,22
45,"mortgage broker mackay qld",10,"$21.02",56,23
46,"mortgage broker milton",70,"$11.13",18,7
47,"mortgage broker new farm",140,"$18.52",26,13
48,"mortgage broker newstead",30,"$18.29",56,31
49,"mortgage broker north adelaide",20,"$0.00",1,5
50,"mortgage broker north brisbane",880,"$19.88",9,23
51,"mortgage broker north lakes",110,"$24.18",59,14
52,"mortgage broker north manly",10,"$0.00",1,5
53,"mortgage broker north melbourne",20,"$20.13",26,13
54,"mortgage broker north perth",50,"$15.16",75,20
55,"mortgage broker north rocks",10,"$0.00",3,6
56,"mortgage broker north ryde",10,"$0.00",4,7
57,"mortgage broker north sydney",260,"$15.60",7,10
58,"mortgage broker north warrandyte",10,"$0.00",14,10
59,"mortgage broker qld",90,"$18.04",46,32
60,"mortgage broker salary brisbane",20,"$0.00",2,6
61,"mortgage broker south brisbane",70,"$6.12",10,17
62,"mortgage broker sunshine coast qld",20,"$18.90",68,26
63,"mortgage broker toowong",20,"$17.10",34,24
64,"mortgage choice brisbane city mortgage broker brisbane",90,"$0.00",1,18
65,"nepali mortgage broker in brisbane",10,"$0.00",17,11
66,"north shore mortgage broker",30,"$15.25",14,15
67,"north sydney mortgage broker",320,"$13.78",5,22
68,"time home loans mortgage broker brisbane",30,"$0.00",4,7
69,"top mortgage broker brisbane",20,"$19.20",57,23
70,"top mortgage broker in brisbane",10,"$0.00",86,31
71,"woodrow finance mortgage broker brisbane",50,"$0.00",5,25
